[
  {
    "pair_id": "pair_004",
    "system_type": "generator",
    "label_id": "P004-L01",
    "label_type": "positive_deviation",
    "difficulty": "categorical_reasoning",
    "component": "emissions tier",
    "parameter": "epa_tier",
    "required_value": "EPA Tier 4",
    "submitted_value": "EPA Tier 2",
    "deviation_type": "below_requirement",
    "severity": "high",
    "expected_finding": "Submitted emissions certification (EPA Tier 2) does not meet the required EPA Tier 4.",
    "evidence_required": {
      "document": "owner_requirement.md",
      "page_or_section": "§1",
      "quote_or_span": "EPA Tier 4 Final"
    },
    "evidence_submitted": {
      "document": "vendor_submittal.md",
      "page_or_section": "§1",
      "quote_or_span": "EPA Tier 2"
    },
    "expected_commissioning_test": "Emissions compliance documentation review",
    "schedule_impact_category": "commissioning_delay_risk",
    "source_basis": "owner_design_basis_team_authored",
    "status": "frozen",
    "reviewer_notes": "",
    "contested": false
  }
]