[
  {
    "pair_id": "pair_012",
    "system_type": "ups",
    "modality": "text",
    "review_status": "single_author_frozen_pending_review",
    "label_id": "P012-L01",
    "label_type": "clean_negative",
    "difficulty": "direct_value",
    "component": "battery autonomy",
    "parameter": "runtime_minutes",
    "required_value": "10 min",
    "submitted_value": "10 min",
    "deviation_type": "none",
    "severity": "none",
    "expected_finding": "No deviation — submitted autonomy meets the requirement.",
    "evidence_required": {
      "document": "owner_requirement.md",
      "page_or_section": "§1",
      "quote_or_span": "at least 10 minutes"
    },
    "evidence_submitted": {
      "document": "vendor_submittal.md",
      "page_or_section": "§1",
      "quote_or_span": "Rated battery runtime: 10 minutes"
    },
    "expected_commissioning_test": "UPS battery autonomy discharge test",
    "schedule_impact_category": "commissioning_delay_risk",
    "source_basis": "synthetic_negative",
    "status": "frozen",
    "reviewer_notes": "",
    "contested": false
  }
]