[
  {
    "pair_id": "pair_010",
    "system_type": "ups",
    "modality": "text",
    "review_status": "single_author_frozen_pending_review",
    "label_id": "P010-L01",
    "label_type": "omission",
    "difficulty": "omission_detection",
    "component": "input THD",
    "parameter": "input_thd_percent",
    "required_value": "5%",
    "submitted_value": "Not stated",
    "deviation_type": "omission",
    "severity": "medium",
    "expected_finding": "The submittal omits the required input THD value ('available upon request').",
    "evidence_required": {
      "document": "owner_requirement.md",
      "page_or_section": "§1",
      "quote_or_span": "shall be stated in the submittal"
    },
    "evidence_submitted": {
      "document": "vendor_submittal.md",
      "page_or_section": "§1",
      "quote_or_span": "available upon request"
    },
    "expected_commissioning_test": "Power-quality documentation completeness check",
    "schedule_impact_category": "commissioning_delay_risk",
    "source_basis": "owner_design_basis_team_authored",
    "status": "frozen",
    "reviewer_notes": "",
    "contested": false
  }
]