[
  {
    "pair_id": "dev_pair_004",
    "label_id": "D004-L01",
    "system_type": "battery",
    "modality": "text",
    "label_type": "omission",
    "difficulty": "omission_detection",
    "component": "hydrogen detection",
    "parameter": "exhaust_interlock_h2_pct",
    "required_value": "2 percent",
    "submitted_value": "Not stated",
    "deviation_type": "omission",
    "severity": "high",
    "expected_finding": "Submittal configures the 1 percent pre-alarm but never addresses the hard-wired exhaust interlock at 2 percent hydrogen.",
    "evidence_required": {
      "document": "owner_requirement.md",
      "page_or_section": "§2",
      "quote_or_span": "At 2 percent hydrogen by volume, start the emergency exhaust fans"
    },
    "evidence_submitted": {
      "document": "vendor_submittal.md",
      "page_or_section": "Sensors",
      "quote_or_span": "Pre-alarm relay configured at 1 percent H2"
    },
    "expected_commissioning_test": "Hydrogen simulator exhaust-interlock test",
    "schedule_impact_category": "commissioning_delay_risk",
    "source_basis": "team_authored_from_public_values",
    "status": "frozen",
    "reviewer_notes": "Development-only label; not independent validation.",
    "contested": false
  }
]
