[
  {
    "pair_id": "pair_037",
    "system_type": "switchgear",
    "modality": "text",
    "review_status": "single_author_frozen_pending_review",
    "label_id": "P037-L01",
    "label_type": "positive_deviation",
    "difficulty": "table_or_layout",
    "component": "short-circuit withstand (table)",
    "parameter": "icw_ka",
    "required_value": "65 kA",
    "submitted_value": "50 kA",
    "deviation_type": "below_requirement",
    "severity": "high",
    "expected_finding": "The type-test table shows 50 kA, below the 65 kA requirement, despite the narrative's 65 kA claim.",
    "evidence_required": {
      "document": "owner_requirement.md",
      "page_or_section": "§1",
      "quote_or_span": ">= 65 kA / 1 s"
    },
    "evidence_submitted": {
      "document": "vendor_submittal.md",
      "page_or_section": "§2",
      "quote_or_span": "Icw (1 s) | 50 kA"
    },
    "expected_commissioning_test": "Switchgear type-test review",
    "schedule_impact_category": "commissioning_delay_risk",
    "source_basis": "owner_design_basis_team_authored",
    "status": "frozen",
    "reviewer_notes": "",
    "contested": false
  },
  {
    "pair_id": "pair_037",
    "system_type": "switchgear",
    "modality": "text",
    "review_status": "single_author_frozen_pending_review",
    "label_id": "P037-L02",
    "label_type": "clean_negative",
    "difficulty": "direct_value",
    "component": "rated voltage",
    "parameter": "voltage_v",
    "required_value": "415 V",
    "submitted_value": "415 V",
    "deviation_type": "none",
    "severity": "none",
    "expected_finding": "No deviation — 415 V as required.",
    "evidence_required": {
      "document": "owner_requirement.md",
      "page_or_section": "§1",
      "quote_or_span": "415 V"
    },
    "evidence_submitted": {
      "document": "vendor_submittal.md",
      "page_or_section": "§1",
      "quote_or_span": "415 V"
    },
    "expected_commissioning_test": "documentation / acceptance review",
    "schedule_impact_category": "commissioning_delay_risk",
    "source_basis": "synthetic_negative",
    "status": "frozen",
    "reviewer_notes": "",
    "contested": false
  }
]