[
  {
    "pair_id": "pair_002",
    "system_type": "metering_power_quality",
    "label_id": "P002-L01",
    "label_type": "positive_deviation",
    "difficulty": "direct_value",
    "component": "input current THD",
    "parameter": "input_thd_percent",
    "required_value": "5%",
    "submitted_value": "8%",
    "deviation_type": "above_limit",
    "severity": "medium",
    "expected_finding": "Submitted input THD (8%) exceeds the 5% owner limit.",
    "evidence_required": {
      "document": "owner_requirement.md",
      "page_or_section": "§1",
      "quote_or_span": "shall not exceed 5 percent"
    },
    "evidence_submitted": {
      "document": "vendor_submittal.md",
      "page_or_section": "§1",
      "quote_or_span": "input current THD: 8 percent"
    },
    "expected_commissioning_test": "Power-quality / harmonic acceptance test",
    "schedule_impact_category": "commissioning_delay_risk",
    "source_basis": "owner_design_basis_team_authored",
    "status": "frozen",
    "reviewer_notes": "",
    "contested": false
  }
]